
Bus 002 Device 002: ID 0bda:0328 Realtek Semiconductor Corp. 
Device Descriptor:
  bLength                18
  bDescriptorType         1
  bcdUSB               3.00
  bDeviceClass            0 (Defined at Interface level)
  bDeviceSubClass         0 
  bDeviceProtocol         0 
  bMaxPacketSize0         9
  idVendor           0x0bda Realtek Semiconductor Corp.
  idProduct          0x0328 
  bcdDevice           29.08
  iManufacturer           1 Generic
  iProduct                2 USB3.0-CRW
  iSerial                 3 28203008282014000
  bNumConfigurations      1
  Configuration Descriptor:
    bLength                 9
    bDescriptorType         2
    wTotalLength           44
    bNumInterfaces          1
    bConfigurationValue     1
    iConfiguration          4 CARD READER
    bmAttributes         0x80
      (Bus Powered)
    MaxPower              200mA
    Interface Descriptor:
      bLength                 9
      bDescriptorType         4
      bInterfaceNumber        0
      bAlternateSetting       0
      bNumEndpoints           2
      bInterfaceClass         8 Mass Storage
      bInterfaceSubClass      6 SCSI
      bInterfaceProtocol     80 Bulk-Only
      iInterface              5 Bulk-In, Bulk-Out, Interface
      Endpoint Descriptor:
        bLength                 7
        bDescriptorType         5
        bEndpointAddress     0x01  EP 1 OUT
        bmAttributes            2
          Transfer Type            Bulk
          Synch Type               None
          Usage Type               Data
        wMaxPacketSize     0x0400  1x 1024 bytes
        bInterval               0
        bMaxBurst              15
      Endpoint Descriptor:
        bLength                 7
        bDescriptorType         5
        bEndpointAddress     0x82  EP 2 IN
        bmAttributes            2
          Transfer Type            Bulk
          Synch Type               None
          Usage Type               Data
        wMaxPacketSize     0x0400  1x 1024 bytes
        bInterval               0
        bMaxBurst              15
Binary Object Store Descriptor:
  bLength                 5
  bDescriptorType        15
  wTotalLength           22
  bNumDeviceCaps          2
  USB 2.0 Extension Device Capability:
    bLength                 7
    bDescriptorType        16
    bDevCapabilityType      2
    bmAttributes   0x0000f41e
      Link Power Management (LPM) Supported
  SuperSpeed USB Device Capability:
    bLength                10
    bDescriptorType        16
    bDevCapabilityType      3
    bmAttributes         0x02
      Latency Tolerance Messages (LTM) Supported
    wSpeedsSupported   0x000e
      Device can operate at Full Speed (12Mbps)
      Device can operate at High Speed (480Mbps)
      Device can operate at SuperSpeed (5Gbps)
    bFunctionalitySupport   1
      Lowest fully-functional device speed is Full Speed (12Mbps)
    bU1DevExitLat          10 micro seconds
    bU2DevExitLat        1023 micro seconds
Device Status:     0x001c
  (Bus Powered)
  U1 Enabled
  U2 Enabled
  Latency Tolerance Messaging (LTM) Enabled

Bus 002 Device 001: ID 1d6b:0003 Linux Foundation 3.0 root hub
Device Descriptor:
  bLength                18
  bDescriptorType         1
  bcdUSB               3.10
  bDeviceClass            9 Hub
  bDeviceSubClass         0 Unused
  bDeviceProtocol         3 
  bMaxPacketSize0         9
  idVendor           0x1d6b Linux Foundation
  idProduct          0x0003 3.0 root hub
  bcdDevice            4.18
  iManufacturer           3 Linux 4.18.0-3-amd64 xhci-hcd
  iProduct                2 xHCI Host Controller
  iSerial                 1 0000:00:14.0
  bNumConfigurations      1
  Configuration Descriptor:
    bLength                 9
    bDescriptorType         2
    wTotalLength           31
    bNumInterfaces          1
    bConfigurationValue     1
    iConfiguration          0 
    bmAttributes         0xe0
      Self Powered
      Remote Wakeup
    MaxPower                0mA
    Interface Descriptor:
      bLength                 9
      bDescriptorType         4
      bInterfaceNumber        0
      bAlternateSetting       0
      bNumEndpoints           1
      bInterfaceClass         9 Hub
      bInterfaceSubClass      0 Unused
      bInterfaceProtocol      0 Full speed (or root) hub
      iInterface              0 
      Endpoint Descriptor:
        bLength                 7
        bDescriptorType         5
        bEndpointAddress     0x81  EP 1 IN
        bmAttributes            3
          Transfer Type            Interrupt
          Synch Type               None
          Usage Type               Data
        wMaxPacketSize     0x0004  1x 4 bytes
        bInterval              12
        bMaxBurst               0
Hub Descriptor:
  bLength              28
  bDescriptorType       0
  nNbrPorts            22
  wHubCharacteristic 0x0200
    Ganged power switching
    Ganged overcurrent protection
  bPwrOn2PwrGood        7 * 2 milli seconds
  bHubContrCurrent     64 milli Ampere
  bHubDecLat          0.2 micro seconds
  wHubDelay           482 nano seconds
  DeviceRemovable    0x00 0x00 0x0a
 Hub Port Status:
   Port 1: 0000.02a0 lowspeed
   Port 2: 0000.02a0 lowspeed
   Port 3: 0000.02a0 lowspeed
   Port 4: 0000.02a0 lowspeed
   Port 5: 0000.0223 lowspeed enable connect
   Port 6: 0000.02a0 lowspeed
   Port 7: 0000.02a0 lowspeed
   Port 8: 0000.02a0 lowspeed
   Port 9: 0000.02a0 lowspeed
   Port 10: 0000.02a0 lowspeed
   Port 11: 0000.02a0 lowspeed
   Port 12: 0000.02a0 lowspeed
   Port 13: 0000.02a0 lowspeed
   Port 14: 0000.02a0 lowspeed
   Port 15: 0000.02a0 lowspeed
   Port 16: 0000.02a0 lowspeed
   Port 17: 0000.02a0 lowspeed
   Port 18: 0000.02a0 lowspeed
   Port 19: 0000.02a0 lowspeed
   Port 20: 0000.02a0 lowspeed
   Port 21: 0000.02a0 lowspeed
   Port 22: 0000.02a0 lowspeed
Binary Object Store Descriptor:
  bLength                 5
  bDescriptorType        15
  wTotalLength           91
  bNumDeviceCaps          2
Device Status:     0x0001
  Self Powered

Bus 001 Device 002: ID 1bcf:2c6b Sunplus Innovation Technology Inc. 
Device Descriptor:
  bLength                18
  bDescriptorType         1
  bcdUSB               2.00
  bDeviceClass          239 Miscellaneous Device
  bDeviceSubClass         2 ?
  bDeviceProtocol         1 Interface Association
  bMaxPacketSize0        64
  idVendor           0x1bcf Sunplus Innovation Technology Inc.
  idProduct          0x2c6b 
  bcdDevice            0.03
  iManufacturer           1 27C40-06N20-L01S83845E
  iProduct                2 HD WebCam
  iSerial                 0 
  bNumConfigurations      1
  Configuration Descriptor:
    bLength                 9
    bDescriptorType         2
    wTotalLength          877
    bNumInterfaces          2
    bConfigurationValue     1
    iConfiguration          0 
    bmAttributes         0x80
      (Bus Powered)
    MaxPower              500mA
    Interface Association:
      bLength                 8
      bDescriptorType        11
      bFirstInterface         0
      bInterfaceCount         2
      bFunctionClass         14 Video
      bFunctionSubClass       3 Video Interface Collection
      bFunctionProtocol       0 
      iFunction               2 HD WebCam
    Interface Descriptor:
      bLength                 9
      bDescriptorType         4
      bInterfaceNumber        0
      bAlternateSetting       0
      bNumEndpoints           1
      bInterfaceClass        14 Video
      bInterfaceSubClass      1 Video Control
      bInterfaceProtocol      0 
      iInterface              2 HD WebCam
      VideoControl Interface Descriptor:
        bLength                13
        bDescriptorType        36
        bDescriptorSubtype      1 (HEADER)
        bcdUVC               1.00
        wTotalLength          109
        dwClockFrequency       48.000000MHz
        bInCollection           1
        baInterfaceNr( 0)       1
      VideoControl Interface Descriptor:
        bLength                18
        bDescriptorType        36
        bDescriptorSubtype      2 (INPUT_TERMINAL)
        bTerminalID             1
        wTerminalType      0x0201 Camera Sensor
        bAssocTerminal          0
        iTerminal               0 
        wObjectiveFocalLengthMin      0
        wObjectiveFocalLengthMax      0
        wOcularFocalLength            0
        bControlSize                  3
        bmControls           0x0000000a
          Auto-Exposure Mode
          Exposure Time (Absolute)
      VideoControl Interface Descriptor:
        bLength                11
        bDescriptorType        36
        bDescriptorSubtype      5 (PROCESSING_UNIT)
      Warning: Descriptor too short
        bUnitID                 2
        bSourceID               1
        wMaxMultiplier      16384
        bControlSize            2
        bmControls     0x0000053f
          Brightness
          Contrast
          Hue
          Saturation
          Sharpness
          Gamma
          Backlight Compensation
          Power Line Frequency
        iProcessing             0 
        bmVideoStandards     0x1d
          None
          PAL - 625/50
          SECAM - 625/50
          NTSC - 625/50
      VideoControl Interface Descriptor:
        bLength                29
        bDescriptorType        36
        bDescriptorSubtype      6 (EXTENSION_UNIT)
        bUnitID                 3
        guidExtensionCode         {c385b80f-c268-4745-90f7-8f47579d95fc}
        bNumControl             0
        bNrPins                 1
        baSourceID( 0)          2
        bControlSize            4
        bmControls( 0)       0x1f
        bmControls( 1)       0x00
        bmControls( 2)       0x00
        bmControls( 3)       0x00
        iExtension              0 
      VideoControl Interface Descriptor:
        bLength                29
        bDescriptorType        36
        bDescriptorSubtype      6 (EXTENSION_UNIT)
        bUnitID                 4
        guidExtensionCode         {82066163-7050-ab49-b8cc-b3855e8d221d}
        bNumControl             0
        bNrPins                 1
        baSourceID( 0)          3
        bControlSize            4
        bmControls( 0)       0xff
        bmControls( 1)       0xff
        bmControls( 2)       0x71
        bmControls( 3)       0x00
        iExtension              0 
      VideoControl Interface Descriptor:
        bLength                 9
        bDescriptorType        36
        bDescriptorSubtype      3 (OUTPUT_TERMINAL)
        bTerminalID             5
        wTerminalType      0x0101 USB Streaming
        bAssocTerminal          0
        bSourceID               4
        iTerminal               0 
      Endpoint Descriptor:
        bLength                 7
        bDescriptorType         5
        bEndpointAddress     0x87  EP 7 IN
        bmAttributes            3
          Transfer Type            Interrupt
          Synch Type               None
          Usage Type               Data
        wMaxPacketSize     0x0010  1x 16 bytes
        bInterval               8
    Interface Descriptor:
      bLength                 9
      bDescriptorType         4
      bInterfaceNumber        1
      bAlternateSetting       0
      bNumEndpoints           0
      bInterfaceClass        14 Video
      bInterfaceSubClass      2 Video Streaming
      bInterfaceProtocol      0 
      iInterface              0 
      VideoStreaming Interface Descriptor:
        bLength                            15
        bDescriptorType                    36
        bDescriptorSubtype                  1 (INPUT_HEADER)
        bNumFormats                         2
        wTotalLength                      545
        bEndPointAddress                  129
        bmInfo                              0
        bTerminalLink                       5
        bStillCaptureMethod                 1
        bTriggerSupport                     1
        bTriggerUsage                       0
        bControlSize                        1
        bmaControls( 0)                    27
        bmaControls( 1)                    27
      VideoStreaming Interface Descriptor:
        bLength                            27
        bDescriptorType                    36
        bDescriptorSubtype                  4 (FORMAT_UNCOMPRESSED)
        bFormatIndex                        1
        bNumFrameDescriptors                8
        guidFormat                            {59555932-0000-1000-8000-00aa00389b71}
        bBitsPerPixel                      16
        bDefaultFrameIndex                  1
        bAspectRatioX                       0
        bAspectRatioY                       0
        bmInterlaceFlags                 0x00
          Interlaced stream or variable: No
          Fields per frame: 2 fields
          Field 1 first: No
          Field pattern: Field 1 only
          bCopyProtect                      0
      VideoStreaming Interface Descriptor:
        bLength                            30
        bDescriptorType                    36
        bDescriptorSubtype                  5 (FRAME_UNCOMPRESSED)
        bFrameIndex                         1
        bmCapabilities                   0x01
          Still image supported
        wWidth                            640
        wHeight                           480
        dwMinBitRate                147456000
        dwMaxBitRate                147456000
        dwMaxVideoFrameBufferSize      614400
        dwDefaultFrameInterval         333333
        bFrameIntervalType                  1
        dwFrameInterval( 0)            333333
      VideoStreaming Interface Descriptor:
        bLength                            30
        bDescriptorType                    36
        bDescriptorSubtype                  5 (FRAME_UNCOMPRESSED)
        bFrameIndex                         2
        bmCapabilities                   0x01
          Still image supported
        wWidth                            320
        wHeight                           180
        dwMinBitRate                 27648000
        dwMaxBitRate                 27648000
        dwMaxVideoFrameBufferSize      115200
        dwDefaultFrameInterval         333333
        bFrameIntervalType                  1
        dwFrameInterval( 0)            333333
      VideoStreaming Interface Descriptor:
        bLength                            30
        bDescriptorType                    36
        bDescriptorSubtype                  5 (FRAME_UNCOMPRESSED)
        bFrameIndex                         3
        bmCapabilities                   0x01
          Still image supported
        wWidth                            320
        wHeight                           240
        dwMinBitRate                 36864000
        dwMaxBitRate                 36864000
        dwMaxVideoFrameBufferSize      153600
        dwDefaultFrameInterval         333333
        bFrameIntervalType                  1
        dwFrameInterval( 0)            333333
      VideoStreaming Interface Descriptor:
        bLength                            30
        bDescriptorType                    36
        bDescriptorSubtype                  5 (FRAME_UNCOMPRESSED)
        bFrameIndex                         4
        bmCapabilities                   0x01
          Still image supported
        wWidth                            424
        wHeight                           240
        dwMinBitRate                 48844800
        dwMaxBitRate                 48844800
        dwMaxVideoFrameBufferSize      203520
        dwDefaultFrameInterval         333333
        bFrameIntervalType                  1
        dwFrameInterval( 0)            333333
      VideoStreaming Interface Descriptor:
        bLength                            30
        bDescriptorType                    36
        bDescriptorSubtype                  5 (FRAME_UNCOMPRESSED)
        bFrameIndex                         5
        bmCapabilities                   0x01
          Still image supported
        wWidth                            640
        wHeight                           360
        dwMinBitRate                110592000
        dwMaxBitRate                110592000
        dwMaxVideoFrameBufferSize      460800
        dwDefaultFrameInterval         333333
        bFrameIntervalType                  1
        dwFrameInterval( 0)            333333
      VideoStreaming Interface Descriptor:
        bLength                            30
        bDescriptorType                    36
        bDescriptorSubtype                  5 (FRAME_UNCOMPRESSED)
        bFrameIndex                         6
        bmCapabilities                   0x01
          Still image supported
        wWidth                            848
        wHeight                           480
        dwMinBitRate                 97689600
        dwMaxBitRate                 97689600
        dwMaxVideoFrameBufferSize      814080
        dwDefaultFrameInterval         666666
        bFrameIntervalType                  1
        dwFrameInterval( 0)            666666
      VideoStreaming Interface Descriptor:
        bLength                            30
        bDescriptorType                    36
        bDescriptorSubtype                  5 (FRAME_UNCOMPRESSED)
        bFrameIndex                         7
        bmCapabilities                   0x01
          Still image supported
        wWidth                            960
        wHeight                           540
        dwMinBitRate                124416000
        dwMaxBitRate                124416000
        dwMaxVideoFrameBufferSize     1036800
        dwDefaultFrameInterval         666666
        bFrameIntervalType                  1
        dwFrameInterval( 0)            666666
      VideoStreaming Interface Descriptor:
        bLength                            30
        bDescriptorType                    36
        bDescriptorSubtype                  5 (FRAME_UNCOMPRESSED)
        bFrameIndex                         8
        bmCapabilities                   0x01
          Still image supported
        wWidth                           1280
        wHeight                           720
        dwMinBitRate                147456000
        dwMaxBitRate                147456000
        dwMaxVideoFrameBufferSize     1843200
        dwDefaultFrameInterval        1000000
        bFrameIntervalType                  1
        dwFrameInterval( 0)           1000000
      VideoStreaming Interface Descriptor:
        bLength                             6
        bDescriptorType                    36
        bDescriptorSubtype                 13 (COLORFORMAT)
        bColorPrimaries                     1 (BT.709,sRGB)
        bTransferCharacteristics            1 (BT.709)
        bMatrixCoefficients                 4 (SMPTE 170M (BT.601))
      VideoStreaming Interface Descriptor:
        bLength                            11
        bDescriptorType                    36
        bDescriptorSubtype                  6 (FORMAT_MJPEG)
        bFormatIndex                        2
        bNumFrameDescriptors                8
        bFlags                              1
          Fixed-size samples: Yes
        bDefaultFrameIndex                  1
        bAspectRatioX                       0
        bAspectRatioY                       0
        bmInterlaceFlags                 0x00
          Interlaced stream or variable: No
          Fields per frame: 1 fields
          Field 1 first: No
          Field pattern: Field 1 only
          bCopyProtect                      0
      VideoStreaming Interface Descriptor:
        bLength                            30
        bDescriptorType                    36
        bDescriptorSubtype                  7 (FRAME_MJPEG)
        bFrameIndex                         1
        bmCapabilities                   0x01
          Still image supported
        wWidth                            640
        wHeight                           480
        dwMinBitRate                147456000
        dwMaxBitRate                147456000
        dwMaxVideoFrameBufferSize      614400
        dwDefaultFrameInterval         333333
        bFrameIntervalType                  1
        dwFrameInterval( 0)            333333
      VideoStreaming Interface Descriptor:
        bLength                            30
        bDescriptorType                    36
        bDescriptorSubtype                  7 (FRAME_MJPEG)
        bFrameIndex                         2
        bmCapabilities                   0x01
          Still image supported
        wWidth                            320
        wHeight                           180
        dwMinBitRate                 27648000
        dwMaxBitRate                 27648000
        dwMaxVideoFrameBufferSize      115200
        dwDefaultFrameInterval         333333
        bFrameIntervalType                  1
        dwFrameInterval( 0)            333333
      VideoStreaming Interface Descriptor:
        bLength                            30
        bDescriptorType                    36
        bDescriptorSubtype                  7 (FRAME_MJPEG)
        bFrameIndex                         3
        bmCapabilities                   0x01
          Still image supported
        wWidth                            320
        wHeight                           240
        dwMinBitRate                 36864000
        dwMaxBitRate                 36864000
        dwMaxVideoFrameBufferSize      153600
        dwDefaultFrameInterval         333333
        bFrameIntervalType                  1
        dwFrameInterval( 0)            333333
      VideoStreaming Interface Descriptor:
        bLength                            30
        bDescriptorType                    36
        bDescriptorSubtype                  7 (FRAME_MJPEG)
        bFrameIndex                         4
        bmCapabilities                   0x01
          Still image supported
        wWidth                            424
        wHeight                           240
        dwMinBitRate                 48844800
        dwMaxBitRate                 48844800
        dwMaxVideoFrameBufferSize      203520
        dwDefaultFrameInterval         333333
        bFrameIntervalType                  1
        dwFrameInterval( 0)            333333
      VideoStreaming Interface Descriptor:
        bLength                            30
        bDescriptorType                    36
        bDescriptorSubtype                  7 (FRAME_MJPEG)
        bFrameIndex                         5
        bmCapabilities                   0x01
          Still image supported
        wWidth                            640
        wHeight                           360
        dwMinBitRate                110592000
        dwMaxBitRate                110592000
        dwMaxVideoFrameBufferSize      460800
        dwDefaultFrameInterval         333333
        bFrameIntervalType                  1
        dwFrameInterval( 0)            333333
      VideoStreaming Interface Descriptor:
        bLength                            30
        bDescriptorType                    36
        bDescriptorSubtype                  7 (FRAME_MJPEG)
        bFrameIndex                         6
        bmCapabilities                   0x01
          Still image supported
        wWidth                            848
        wHeight                           480
        dwMinBitRate                195379200
        dwMaxBitRate                195379200
        dwMaxVideoFrameBufferSize      814080
        dwDefaultFrameInterval         333333
        bFrameIntervalType                  1
        dwFrameInterval( 0)            333333
      VideoStreaming Interface Descriptor:
        bLength                            30
        bDescriptorType                    36
        bDescriptorSubtype                  7 (FRAME_MJPEG)
        bFrameIndex                         7
        bmCapabilities                   0x01
          Still image supported
        wWidth                            960
        wHeight                           540
        dwMinBitRate                248832000
        dwMaxBitRate                248832000
        dwMaxVideoFrameBufferSize     1036800
        dwDefaultFrameInterval         333333
        bFrameIntervalType                  1
        dwFrameInterval( 0)            333333
      VideoStreaming Interface Descriptor:
        bLength                            30
        bDescriptorType                    36
        bDescriptorSubtype                  7 (FRAME_MJPEG)
        bFrameIndex                         8
        bmCapabilities                   0x01
          Still image supported
        wWidth                           1280
        wHeight                           720
        dwMinBitRate                442368000
        dwMaxBitRate                442368000
        dwMaxVideoFrameBufferSize     1843200
        dwDefaultFrameInterval         333333
        bFrameIntervalType                  1
        dwFrameInterval( 0)            333333
      VideoStreaming Interface Descriptor:
        bLength                             6
        bDescriptorType                    36
        bDescriptorSubtype                 13 (COLORFORMAT)
        bColorPrimaries                     1 (BT.709,sRGB)
        bTransferCharacteristics            1 (BT.709)
        bMatrixCoefficients                 4 (SMPTE 170M (BT.601))
    Interface Descriptor:
      bLength                 9
      bDescriptorType         4
      bInterfaceNumber        1
      bAlternateSetting       1
      bNumEndpoints           1
      bInterfaceClass        14 Video
      bInterfaceSubClass      2 Video Streaming
      bInterfaceProtocol      0 
      iInterface              0 
      Endpoint Descriptor:
        bLength                 7
        bDescriptorType         5
        bEndpointAddress     0x81  EP 1 IN
        bmAttributes            5
          Transfer Type            Isochronous
          Synch Type               Asynchronous
          Usage Type               Data
        wMaxPacketSize     0x00c0  1x 192 bytes
        bInterval               1
    Interface Descriptor:
      bLength                 9
      bDescriptorType         4
      bInterfaceNumber        1
      bAlternateSetting       2
      bNumEndpoints           1
      bInterfaceClass        14 Video
      bInterfaceSubClass      2 Video Streaming
      bInterfaceProtocol      0 
      iInterface              0 
      Endpoint Descriptor:
        bLength                 7
        bDescriptorType         5
        bEndpointAddress     0x81  EP 1 IN
        bmAttributes            5
          Transfer Type            Isochronous
          Synch Type               Asynchronous
          Usage Type               Data
        wMaxPacketSize     0x0180  1x 384 bytes
        bInterval               1
    Interface Descriptor:
      bLength                 9
      bDescriptorType         4
      bInterfaceNumber        1
      bAlternateSetting       3
      bNumEndpoints           1
      bInterfaceClass        14 Video
      bInterfaceSubClass      2 Video Streaming
      bInterfaceProtocol      0 
      iInterface              0 
      Endpoint Descriptor:
        bLength                 7
        bDescriptorType         5
        bEndpointAddress     0x81  EP 1 IN
        bmAttributes            5
          Transfer Type            Isochronous
          Synch Type               Asynchronous
          Usage Type               Data
        wMaxPacketSize     0x0200  1x 512 bytes
        bInterval               1
    Interface Descriptor:
      bLength                 9
      bDescriptorType         4
      bInterfaceNumber        1
      bAlternateSetting       4
      bNumEndpoints           1
      bInterfaceClass        14 Video
      bInterfaceSubClass      2 Video Streaming
      bInterfaceProtocol      0 
      iInterface              0 
      Endpoint Descriptor:
        bLength                 7
        bDescriptorType         5
        bEndpointAddress     0x81  EP 1 IN
        bmAttributes            5
          Transfer Type            Isochronous
          Synch Type               Asynchronous
          Usage Type               Data
        wMaxPacketSize     0x0280  1x 640 bytes
        bInterval               1
    Interface Descriptor:
      bLength                 9
      bDescriptorType         4
      bInterfaceNumber        1
      bAlternateSetting       5
      bNumEndpoints           1
      bInterfaceClass        14 Video
      bInterfaceSubClass      2 Video Streaming
      bInterfaceProtocol      0 
      iInterface              0 
      Endpoint Descriptor:
        bLength                 7
        bDescriptorType         5
        bEndpointAddress     0x81  EP 1 IN
        bmAttributes            5
          Transfer Type            Isochronous
          Synch Type               Asynchronous
          Usage Type               Data
        wMaxPacketSize     0x0320  1x 800 bytes
        bInterval               1
    Interface Descriptor:
      bLength                 9
      bDescriptorType         4
      bInterfaceNumber        1
      bAlternateSetting       6
      bNumEndpoints           1
      bInterfaceClass        14 Video
      bInterfaceSubClass      2 Video Streaming
      bInterfaceProtocol      0 
      iInterface              0 
      Endpoint Descriptor:
        bLength                 7
        bDescriptorType         5
        bEndpointAddress     0x81  EP 1 IN
        bmAttributes            5
          Transfer Type            Isochronous
          Synch Type               Asynchronous
          Usage Type               Data
        wMaxPacketSize     0x03b0  1x 944 bytes
        bInterval               1
    Interface Descriptor:
      bLength                 9
      bDescriptorType         4
      bInterfaceNumber        1
      bAlternateSetting       7
      bNumEndpoints           1
      bInterfaceClass        14 Video
      bInterfaceSubClass      2 Video Streaming
      bInterfaceProtocol      0 
      iInterface              0 
      Endpoint Descriptor:
        bLength                 7
        bDescriptorType         5
        bEndpointAddress     0x81  EP 1 IN
        bmAttributes            5
          Transfer Type            Isochronous
          Synch Type               Asynchronous
          Usage Type               Data
        wMaxPacketSize     0x0a80  2x 640 bytes
        bInterval               1
    Interface Descriptor:
      bLength                 9
      bDescriptorType         4
      bInterfaceNumber        1
      bAlternateSetting       8
      bNumEndpoints           1
      bInterfaceClass        14 Video
      bInterfaceSubClass      2 Video Streaming
      bInterfaceProtocol      0 
      iInterface              0 
      Endpoint Descriptor:
        bLength                 7
        bDescriptorType         5
        bEndpointAddress     0x81  EP 1 IN
        bmAttributes            5
          Transfer Type            Isochronous
          Synch Type               Asynchronous
          Usage Type               Data
        wMaxPacketSize     0x0b20  2x 800 bytes
        bInterval               1
    Interface Descriptor:
      bLength                 9
      bDescriptorType         4
      bInterfaceNumber        1
      bAlternateSetting       9
      bNumEndpoints           1
      bInterfaceClass        14 Video
      bInterfaceSubClass      2 Video Streaming
      bInterfaceProtocol      0 
      iInterface              0 
      Endpoint Descriptor:
        bLength                 7
        bDescriptorType         5
        bEndpointAddress     0x81  EP 1 IN
        bmAttributes            5
          Transfer Type            Isochronous
          Synch Type               Asynchronous
          Usage Type               Data
        wMaxPacketSize     0x0be0  2x 992 bytes
        bInterval               1
    Interface Descriptor:
      bLength                 9
      bDescriptorType         4
      bInterfaceNumber        1
      bAlternateSetting      10
      bNumEndpoints           1
      bInterfaceClass        14 Video
      bInterfaceSubClass      2 Video Streaming
      bInterfaceProtocol      0 
      iInterface              0 
      Endpoint Descriptor:
        bLength                 7
        bDescriptorType         5
        bEndpointAddress     0x81  EP 1 IN
        bmAttributes            5
          Transfer Type            Isochronous
          Synch Type               Asynchronous
          Usage Type               Data
        wMaxPacketSize     0x13c0  3x 960 bytes
        bInterval               1
    Interface Descriptor:
      bLength                 9
      bDescriptorType         4
      bInterfaceNumber        1
      bAlternateSetting      11
      bNumEndpoints           1
      bInterfaceClass        14 Video
      bInterfaceSubClass      2 Video Streaming
      bInterfaceProtocol      0 
      iInterface              0 
      Endpoint Descriptor:
        bLength                 7
        bDescriptorType         5
        bEndpointAddress     0x81  EP 1 IN
        bmAttributes            5
          Transfer Type            Isochronous
          Synch Type               Asynchronous
          Usage Type               Data
        wMaxPacketSize     0x13fc  3x 1020 bytes
        bInterval               1
Device Qualifier (for other device speed):
  bLength                10
  bDescriptorType         6
  bcdUSB               2.00
  bDeviceClass          239 Miscellaneous Device
  bDeviceSubClass         2 ?
  bDeviceProtocol         1 Interface Association
  bMaxPacketSize0        64
  bNumConfigurations      1
Device Status:     0x0000
  (Bus Powered)

Bus 001 Device 004: ID 1044:7a39 Chu Yuen Enterprise Co., Ltd 
Device Descriptor:
  bLength                18
  bDescriptorType         1
  bcdUSB               1.10
  bDeviceClass            0 (Defined at Interface level)
  bDeviceSubClass         0 
  bDeviceProtocol         0 
  bMaxPacketSize0        64
  idVendor           0x1044 Chu Yuen Enterprise Co., Ltd
  idProduct          0x7a39 
  bcdDevice            3.08
  iManufacturer           1 HOLTEK
  iProduct                2 USB-HID Keyboard
  iSerial                 3 AP0000000003
  bNumConfigurations      1
  Configuration Descriptor:
    bLength                 9
    bDescriptorType         2
    wTotalLength          123
    bNumInterfaces          4
    bConfigurationValue     1
    iConfiguration          0 
    bmAttributes         0xa0
      (Bus Powered)
      Remote Wakeup
    MaxPower              100mA
    Interface Descriptor:
      bLength                 9
      bDescriptorType         4
      bInterfaceNumber        0
      bAlternateSetting       0
      bNumEndpoints           1
      bInterfaceClass         3 Human Interface Device
      bInterfaceSubClass      1 Boot Interface Subclass
      bInterfaceProtocol      1 Keyboard
      iInterface              0 
        HID Device Descriptor:
          bLength                 9
          bDescriptorType        33
          bcdHID               1.11
          bCountryCode            0 Not supported
          bNumDescriptors         1
          bDescriptorType        34 Report
          wDescriptorLength      59
         Report Descriptors: 
           ** UNAVAILABLE **
      Endpoint Descriptor:
        bLength                 7
        bDescriptorType         5
        bEndpointAddress     0x81  EP 1 IN
        bmAttributes            3
          Transfer Type            Interrupt
          Synch Type               None
          Usage Type               Data
        wMaxPacketSize     0x0008  1x 8 bytes
        bInterval              10
    Interface Descriptor:
      bLength                 9
      bDescriptorType         4
      bInterfaceNumber        1
      bAlternateSetting       0
      bNumEndpoints           2
      bInterfaceClass         3 Human Interface Device
      bInterfaceSubClass      0 No Subclass
      bInterfaceProtocol      0 None
      iInterface              0 
        HID Device Descriptor:
          bLength                 9
          bDescriptorType        33
          bcdHID               1.11
          bCountryCode            0 Not supported
          bNumDescriptors         1
          bDescriptorType        34 Report
          wDescriptorLength      34
         Report Descriptors: 
           ** UNAVAILABLE **
      Endpoint Descriptor:
        bLength                 7
        bDescriptorType         5
        bEndpointAddress     0x83  EP 3 IN
        bmAttributes            3
          Transfer Type            Interrupt
          Synch Type               None
          Usage Type               Data
        wMaxPacketSize     0x0040  1x 64 bytes
        bInterval              10
      Endpoint Descriptor:
        bLength                 7
        bDescriptorType         5
        bEndpointAddress     0x04  EP 4 OUT
        bmAttributes            3
          Transfer Type            Interrupt
          Synch Type               None
          Usage Type               Data
        wMaxPacketSize     0x0040  1x 64 bytes
        bInterval              10
    Interface Descriptor:
      bLength                 9
      bDescriptorType         4
      bInterfaceNumber        2
      bAlternateSetting       0
      bNumEndpoints           1
      bInterfaceClass         3 Human Interface Device
      bInterfaceSubClass      0 No Subclass
      bInterfaceProtocol      0 None
      iInterface              0 
        HID Device Descriptor:
          bLength                 9
          bDescriptorType        33
          bcdHID               1.11
          bCountryCode            0 Not supported
          bNumDescriptors         1
          bDescriptorType        34 Report
          wDescriptorLength     205
         Report Descriptors: 
           ** UNAVAILABLE **
      Endpoint Descriptor:
        bLength                 7
        bDescriptorType         5
        bEndpointAddress     0x82  EP 2 IN
        bmAttributes            3
          Transfer Type            Interrupt
          Synch Type               None
          Usage Type               Data
        wMaxPacketSize     0x0040  1x 64 bytes
        bInterval              10
    Interface Descriptor:
      bLength                 9
      bDescriptorType         4
      bInterfaceNumber        3
      bAlternateSetting       0
      bNumEndpoints           2
      bInterfaceClass         3 Human Interface Device
      bInterfaceSubClass      0 No Subclass
      bInterfaceProtocol      0 None
      iInterface              0 
        HID Device Descriptor:
          bLength                 9
          bDescriptorType        33
          bcdHID               1.11
          bCountryCode            0 Not supported
          bNumDescriptors         1
          bDescriptorType        34 Report
          wDescriptorLength      31
         Report Descriptors: 
           ** UNAVAILABLE **
      Endpoint Descriptor:
        bLength                 7
        bDescriptorType         5
        bEndpointAddress     0x85  EP 5 IN
        bmAttributes            3
          Transfer Type            Interrupt
          Synch Type               None
          Usage Type               Data
        wMaxPacketSize     0x0040  1x 64 bytes
        bInterval              10
      Endpoint Descriptor:
        bLength                 7
        bDescriptorType         5
        bEndpointAddress     0x06  EP 6 OUT
        bmAttributes            3
          Transfer Type            Interrupt
          Synch Type               None
          Usage Type               Data
        wMaxPacketSize     0x0040  1x 64 bytes
        bInterval              10
Device Status:     0x0000
  (Bus Powered)

Bus 001 Device 003: ID 0489:e07a Foxconn / Hon Hai 
Device Descriptor:
  bLength                18
  bDescriptorType         1
  bcdUSB               2.00
  bDeviceClass          255 Vendor Specific Class
  bDeviceSubClass         1 
  bDeviceProtocol         1 
  bMaxPacketSize0        64
  idVendor           0x0489 Foxconn / Hon Hai
  idProduct          0xe07a 
  bcdDevice            1.12
  iManufacturer           1 Broadcom Corp
  iProduct                2 BCM20702A0
  iSerial                 3 48E244E27626
  bNumConfigurations      1
  Configuration Descriptor:
    bLength                 9
    bDescriptorType         2
    wTotalLength          218
    bNumInterfaces          4
    bConfigurationValue     1
    iConfiguration          0 
    bmAttributes         0xe0
      Self Powered
      Remote Wakeup
    MaxPower                0mA
    Interface Descriptor:
      bLength                 9
      bDescriptorType         4
      bInterfaceNumber        0
      bAlternateSetting       0
      bNumEndpoints           3
      bInterfaceClass       255 Vendor Specific Class
      bInterfaceSubClass      1 
      bInterfaceProtocol      1 
      iInterface              0 
      Endpoint Descriptor:
        bLength                 7
        bDescriptorType         5
        bEndpointAddress     0x81  EP 1 IN
        bmAttributes            3
          Transfer Type            Interrupt
          Synch Type               None
          Usage Type               Data
        wMaxPacketSize     0x0010  1x 16 bytes
        bInterval               1
      Endpoint Descriptor:
        bLength                 7
        bDescriptorType         5
        bEndpointAddress     0x82  EP 2 IN
        bmAttributes            2
          Transfer Type            Bulk
          Synch Type               None
          Usage Type               Data
        wMaxPacketSize     0x0040  1x 64 bytes
        bInterval               1
      Endpoint Descriptor:
        bLength                 7
        bDescriptorType         5
        bEndpointAddress     0x02  EP 2 OUT
        bmAttributes            2
          Transfer Type            Bulk
          Synch Type               None
          Usage Type               Data
        wMaxPacketSize     0x0040  1x 64 bytes
        bInterval               1
    Interface Descriptor:
      bLength                 9
      bDescriptorType         4
      bInterfaceNumber        1
      bAlternateSetting       0
      bNumEndpoints           2
      bInterfaceClass       255 Vendor Specific Class
      bInterfaceSubClass      1 
      bInterfaceProtocol      1 
      iInterface              0 
      Endpoint Descriptor:
        bLength                 7
        bDescriptorType         5
        bEndpointAddress     0x83  EP 3 IN
        bmAttributes            1
          Transfer Type            Isochronous
          Synch Type               None
          Usage Type               Data
        wMaxPacketSize     0x0000  1x 0 bytes
        bInterval               1
      Endpoint Descriptor:
        bLength                 7
        bDescriptorType         5
        bEndpointAddress     0x03  EP 3 OUT
        bmAttributes            1
          Transfer Type            Isochronous
          Synch Type               None
          Usage Type               Data
        wMaxPacketSize     0x0000  1x 0 bytes
        bInterval               1
    Interface Descriptor:
      bLength                 9
      bDescriptorType         4
      bInterfaceNumber        1
      bAlternateSetting       1
      bNumEndpoints           2
      bInterfaceClass       255 Vendor Specific Class
      bInterfaceSubClass      1 
      bInterfaceProtocol      1 
      iInterface              0 
      Endpoint Descriptor:
        bLength                 7
        bDescriptorType         5
        bEndpointAddress     0x83  EP 3 IN
        bmAttributes            1
          Transfer Type            Isochronous
          Synch Type               None
          Usage Type               Data
        wMaxPacketSize     0x0009  1x 9 bytes
        bInterval               1
      Endpoint Descriptor:
        bLength                 7
        bDescriptorType         5
        bEndpointAddress     0x03  EP 3 OUT
        bmAttributes            1
          Transfer Type            Isochronous
          Synch Type               None
          Usage Type               Data
        wMaxPacketSize     0x0009  1x 9 bytes
        bInterval               1
    Interface Descriptor:
      bLength                 9
      bDescriptorType         4
      bInterfaceNumber        1
      bAlternateSetting       2
      bNumEndpoints           2
      bInterfaceClass       255 Vendor Specific Class
      bInterfaceSubClass      1 
      bInterfaceProtocol      1 
      iInterface              0 
      Endpoint Descriptor:
        bLength                 7
        bDescriptorType         5
        bEndpointAddress     0x83  EP 3 IN
        bmAttributes            1
          Transfer Type            Isochronous
          Synch Type               None
          Usage Type               Data
        wMaxPacketSize     0x0011  1x 17 bytes
        bInterval               1
      Endpoint Descriptor:
        bLength                 7
        bDescriptorType         5
        bEndpointAddress     0x03  EP 3 OUT
        bmAttributes            1
          Transfer Type            Isochronous
          Synch Type               None
          Usage Type               Data
        wMaxPacketSize     0x0011  1x 17 bytes
        bInterval               1
    Interface Descriptor:
      bLength                 9
      bDescriptorType         4
      bInterfaceNumber        1
      bAlternateSetting       3
      bNumEndpoints           2
      bInterfaceClass       255 Vendor Specific Class
      bInterfaceSubClass      1 
      bInterfaceProtocol      1 
      iInterface              0 
      Endpoint Descriptor:
        bLength                 7
        bDescriptorType         5
        bEndpointAddress     0x83  EP 3 IN
        bmAttributes            1
          Transfer Type            Isochronous
          Synch Type               None
          Usage Type               Data
        wMaxPacketSize     0x0019  1x 25 bytes
        bInterval               1
      Endpoint Descriptor:
        bLength                 7
        bDescriptorType         5
        bEndpointAddress     0x03  EP 3 OUT
        bmAttributes            1
          Transfer Type            Isochronous
          Synch Type               None
          Usage Type               Data
        wMaxPacketSize     0x0019  1x 25 bytes
        bInterval               1
    Interface Descriptor:
      bLength                 9
      bDescriptorType         4
      bInterfaceNumber        1
      bAlternateSetting       4
      bNumEndpoints           2
      bInterfaceClass       255 Vendor Specific Class
      bInterfaceSubClass      1 
      bInterfaceProtocol      1 
      iInterface              0 
      Endpoint Descriptor:
        bLength                 7
        bDescriptorType         5
        bEndpointAddress     0x83  EP 3 IN
        bmAttributes            1
          Transfer Type            Isochronous
          Synch Type               None
          Usage Type               Data
        wMaxPacketSize     0x0021  1x 33 bytes
        bInterval               1
      Endpoint Descriptor:
        bLength                 7
        bDescriptorType         5
        bEndpointAddress     0x03  EP 3 OUT
        bmAttributes            1
          Transfer Type            Isochronous
          Synch Type               None
          Usage Type               Data
        wMaxPacketSize     0x0021  1x 33 bytes
        bInterval               1
    Interface Descriptor:
      bLength                 9
      bDescriptorType         4
      bInterfaceNumber        1
      bAlternateSetting       5
      bNumEndpoints           2
      bInterfaceClass       255 Vendor Specific Class
      bInterfaceSubClass      1 
      bInterfaceProtocol      1 
      iInterface              0 
      Endpoint Descriptor:
        bLength                 7
        bDescriptorType         5
        bEndpointAddress     0x83  EP 3 IN
        bmAttributes            1
          Transfer Type            Isochronous
          Synch Type               None
          Usage Type               Data
        wMaxPacketSize     0x0031  1x 49 bytes
        bInterval               1
      Endpoint Descriptor:
        bLength                 7
        bDescriptorType         5
        bEndpointAddress     0x03  EP 3 OUT
        bmAttributes            1
          Transfer Type            Isochronous
          Synch Type               None
          Usage Type               Data
        wMaxPacketSize     0x0031  1x 49 bytes
        bInterval               1
    Interface Descriptor:
      bLength                 9
      bDescriptorType         4
      bInterfaceNumber        2
      bAlternateSetting       0
      bNumEndpoints           2
      bInterfaceClass       255 Vendor Specific Class
      bInterfaceSubClass    255 Vendor Specific Subclass
      bInterfaceProtocol    255 Vendor Specific Protocol
      iInterface              0 
      Endpoint Descriptor:
        bLength                 7
        bDescriptorType         5
        bEndpointAddress     0x84  EP 4 IN
        bmAttributes            2
          Transfer Type            Bulk
          Synch Type               None
          Usage Type               Data
        wMaxPacketSize     0x0020  1x 32 bytes
        bInterval               1
      Endpoint Descriptor:
        bLength                 7
        bDescriptorType         5
        bEndpointAddress     0x04  EP 4 OUT
        bmAttributes            2
          Transfer Type            Bulk
          Synch Type               None
          Usage Type               Data
        wMaxPacketSize     0x0020  1x 32 bytes
        bInterval               1
    Interface Descriptor:
      bLength                 9
      bDescriptorType         4
      bInterfaceNumber        3
      bAlternateSetting       0
      bNumEndpoints           0
      bInterfaceClass       254 Application Specific Interface
      bInterfaceSubClass      1 Device Firmware Update
      bInterfaceProtocol      1 
      iInterface              0 
      Device Firmware Upgrade Interface Descriptor:
        bLength                             9
        bDescriptorType                    33
        bmAttributes                        5
          Will Not Detach
          Manifestation Tolerant
          Upload Unsupported
          Download Supported
        wDetachTimeout                   5000 milliseconds
        wTransferSize                      64 bytes
        bcdDFUVersion                   1.10
Device Status:     0x0001
  Self Powered

Bus 001 Device 001: ID 1d6b:0002 Linux Foundation 2.0 root hub
Device Descriptor:
  bLength                18
  bDescriptorType         1
  bcdUSB               2.00
  bDeviceClass            9 Hub
  bDeviceSubClass         0 Unused
  bDeviceProtocol         1 Single TT
  bMaxPacketSize0        64
  idVendor           0x1d6b Linux Foundation
  idProduct          0x0002 2.0 root hub
  bcdDevice            4.18
  iManufacturer           3 Linux 4.18.0-3-amd64 xhci-hcd
  iProduct                2 xHCI Host Controller
  iSerial                 1 0000:00:14.0
  bNumConfigurations      1
  Configuration Descriptor:
    bLength                 9
    bDescriptorType         2
    wTotalLength           25
    bNumInterfaces          1
    bConfigurationValue     1
    iConfiguration          0 
    bmAttributes         0xe0
      Self Powered
      Remote Wakeup
    MaxPower                0mA
    Interface Descriptor:
      bLength                 9
      bDescriptorType         4
      bInterfaceNumber        0
      bAlternateSetting       0
      bNumEndpoints           1
      bInterfaceClass         9 Hub
      bInterfaceSubClass      0 Unused
      bInterfaceProtocol      0 Full speed (or root) hub
      iInterface              0 
      Endpoint Descriptor:
        bLength                 7
        bDescriptorType         5
        bEndpointAddress     0x81  EP 1 IN
        bmAttributes            3
          Transfer Type            Interrupt
          Synch Type               None
          Usage Type               Data
        wMaxPacketSize     0x0004  1x 4 bytes
        bInterval              12
Hub Descriptor:
  bLength              13
  bDescriptorType      41
  nNbrPorts            16
  wHubCharacteristic 0x000a
    No power switching (usb 1.0)
    Per-port overcurrent protection
    TT think time 8 FS bits
  bPwrOn2PwrGood       10 * 2 milli seconds
  bHubContrCurrent      0 milli Ampere
  DeviceRemovable    0x20 0x0e 0x00
  PortPwrCtrlMask    0xff 0xff 0xff
 Hub Port Status:
   Port 1: 0000.0100 power
   Port 2: 0000.0100 power
   Port 3: 0000.0100 power
   Port 4: 0000.0100 power
   Port 5: 0000.0100 power
   Port 6: 0000.0100 power
   Port 7: 0000.0100 power
   Port 8: 0000.0100 power
   Port 9: 0000.0503 highspeed power enable connect
   Port 10: 0000.0103 power enable connect
   Port 11: 0000.0103 power enable connect
   Port 12: 0000.0100 power
   Port 13: 0000.0100 power
   Port 14: 0000.0100 power
   Port 15: 0000.0100 power
   Port 16: 0000.0100 power
Device Status:     0x0001
  Self Powered
